{
  "id": "00000000-0000-4000-8000-000000000001",
  "source": "ai",
  "timestamp_decision": "2026-08-05T12:00:00.000Z",
  "freshness_window_ms": 500,
  "deadline_ms": 800,
  "preconditions": [
    { "expr": "line.state == 'RUN'" },
    { "expr": "gripper.state == 'OPEN'" }
  ],
  "payload": {
    "action_type": "RESUME",
    "target_entity": "conveyor_1",
    "parameters": { "reason": "next_part" }
  },
  "priority": 5
}
